29/03/2016,Jantar,Saladas diversas Hambúrguer Opção vegetariana: hambúrguer de pvt Purê de batata Sobremesa: doce de banana laranja Minipão suco
30/03/2016,Jantar,Saladas diversas Steak de frango Opção vegetariana: pvt ao vinagrete Creme de milho Sobremesa: flan de baunilha maçã Minipão suco
30/03/2016,Almoço,Saladas diversas Copa lombo ao molho de limão Opção vegetariana: torta de pvt Farofa simples Sobremesa: arroz doce banana Minipão suco
31/03/2016,Almoço,Saladas diversas Jardineira de carne moida Opção vegetariana: pvt com azeitonas Acelga ao shoyu Sobremesa: gelatina laranja Minipão suco
31/03/2016,Jantar,Saladas diversas Strogonoff de carne Opção vegetariana: pvt ao molho de cogumelos Batata palha Sobremesa: pudim de caramelo banana Minipão suco
01/04/2016,Almoço,Filé de frango grelhado ao molho shoyu Opção vegetariana: pvt rica Repolho alemão com ervilha Sobremesa: bananada maçã Minipão suco
01/04/2016,Jantar,Linguiça acebolada Opção vegetariana: torta de pvt Virado de acelga Sobremesa: pudim de chocolate melancia Minipão suco
02/04/2016,Jantar,Saladas diversas Kibe assado Opção vegetariana: pvt alemão Sobremesa: gelatina melão Minipão suco
04/04/2016,Jantar,Saladas Diversas Fricassê de Frango Opção Vegetariana: Ovo Cozido Cenoura Sauté Sobremesa: Gelatina Framboesa Laranja Minipão Suco Minipão Suco
05/04/2016,Almoço,Saladas Diversas Jardineira de Carne Moída Opção Vegetariana: Jardineira de PVT Macarrão ao Alho e Óleo Sobremesa: Brigadeirão Goiaba Minipão Suco
05/04/2016,Jantar,Saladas Diversas Filé de Frango Grelhado ao M Vinagrete Opção Vegetariana: PVT Caipira Creme de Milho Sobremesa: Flan de Papaya Banana Minipão Suco
06/04/2016,Almoço,Saladas Diversas Strogonoff de Carne Opção Vegetariana: PVT com Legumes Batata Palha Sobremesa: Manjar com Calda Mamão Minipão Suco
06/04/2016,Jantar,Saladas Diversas Linguiça Calabresa Opção Vegetariana: PVT com Grão de Bico e Brócolis Repolho Bicolor Sobremesa Doce de Banana Maçã Minipão Suco
07/04/2016,Almoço,Bife de Panela ao M Vermelho Opção Vegetariana: PVT com Mandioquinha Polenta Cremosa Sobremesa: Pudim de Morango Laranja
07/04/2016,Jantar,Saladas Diversas Isca de Carne com Cebola Opção Vegetariana: PVT Alemão Abobrinha Refogada Sobremesa: Pudim Morango Banana Minipão Suco Minipão Suco
08/04/2016,Almoço,Saladas Diversas Cupim Assado Opção Vegetariana: PVT com Azeitona Purê Sobremesa: Pudim Caramelo Caqui Minipão Suco
11/04/2016,Almoço,Saladas Diversas Strogonoff de Frango Opção Vegetariana: PVT com champignon Batata Palha Sobremesa: Flan de Baunilha Maçã
12/04/2016,Almoço,Saladas Diversas Linguiça Calabresa Acebolada Opção Vegetariana: PVT Gratinado Virado de Escarola Sobremesa: Gelatina de Morango Ponkan
12/04/2016,Jantar,Saladas Diversas Escondidinho de Carne Moída Opção Vegetariana: PVT com Azeitona Repolho Refogado Sobremesa: Doce de Goiabada Banana Minipão Suco Minipão Suco
13/04/2016,Almoço,Saladas Diversas Lagarto Assado ao Molho Escuro Opção Vegetariana: PVT com Mandioca Polenta Cremosa Sobremesa: Arroz doce Caqui Minipão Suco
13/04/2016,Jantar,Saladas Diversas Bisteca Suína Opção Vegetariana PVT com Couve Flor Farofa Rica Sobremesa: Curau Abacaxi Minipão Suco
14/04/2016,Jantar,Strogonoff de Carne Opção Vegetariana: PVT Alemão Batata Palha Sobremesa: Sagú Mamão Minipão Suco
14/04/2016,Almoço,Frango Xadrez Opção Vegetariana: Xadrez de PVT Acelga Refogada Sobremesa: Doce de Leite Laranja Minipão Suco
18/04/2016,Almoço,Saladas Diversas Kibe Assado Opção Vegetariana: PVT com Azeitona Creme de Espinafre Sobremesa: Pé de Moleque Laranja Minipão Suco
18/04/2016,Jantar,Saladas Diversas Fricassê de Frango Opção Vegetariana: PVT Alemão Cenoura Refogada Sobremesa: Pudim de Chocolate Abacaxi Minipão Suco
19/04/2016,Almoço,Saladas Diversas Jardineira de Carne Moída Opção Vegetariana: Jardineira de PVT Polenta Sobremesa: Gelatina de Uva Mamão Minipão Suco
19/04/2016,Jantar,Saladas Diversas Copa Lombo ao Molho de Hortelã Opção Vegetariana: PVT com Mandioca Farofa Sobremesa: Doce de Cocada Cremosa Goiaba Minipão Suco
20/04/2016,Almoço,Saladas Diversas Strogonoff de Carne Opção Vegetariana: Abobrinha Recheada com PVT Batata Palha Sobremesa: Flan de Baunilha Banana
20/04/2016,Jantar,Saladas Diversas Coxa de Frango ao M Pizzaiollo Opção Vegetariana: PVT ao Vinagrete Macarrão ao Alho e Óleo Sobremesa: Sagú Caqui Minipão Suco Minipão Suco
25/04/2016,Almoço,Saladas Diversas Linguiça Calabresa Acebolada Opção Vegetariana: PVT com Legumes Farofa Rica Sobremesa: Doce de leite indust Laranja Minipão Suco
25/04/2016,Jantar,Saladas Diversas Picadinho à Fazendinha Opção Vegetariana: PVT com Azeitona Batata SautØ Sobremesa: Gelatina de uva Maçã Minipão Suco
26/04/2016,Almoço,Saladas Diversas Strogonoff de Frango Opção Vegetariana: PVT Champignon Batata Palha Sobremesa: Pudim de Morango Banana Minipão Suco
26/04/2016,Jantar,Saladas Diversas Hambœrguer ao Molho Opção Vegetariana: Hambœrguer de PVT Chuchu Refogado Sobremesa: Goiabada Cremosa Caqui Minipão Suco
27/04/2016,Almoço,Saladas Diversas Bife Grelhado Opção Vegetariana: PVT Gratinado Berinjela Refogada Sobremesa: Flan de Baunilha Goiaba Minipão Suco
27/04/2016,Jantar,Frango Acebolado Opção Vegetariana: PVT Caipira Purê de Batata Sobremesa: Cocada Cremosa Ind Melão Minipão Suco
28/04/2016,Almoço,Saladas Diversas Filé de Coxa Assada Opção Vegetariana: PVT com Mandioca Creme de Milho Sobremesa: Brigadeirão Maçã Minipão Suco
28/04/2016,Jantar,Saladas Diversas Strogonoff de Carne Opção Vegetariana: PVT com Brócolis Batata Palha Sobremesa: Arroz doce Banana Minipão Suco
29/04/2016,Almoço,Saladas Diversas Copa Lombo ao Molho de Alecrim Opção Vegetariana: Ovo Cozido Virado de Abobrinha Sobremesa: Manjar com Calda Minipão Suco
29/04/2016,Jantar,Saladas Diversas Picadinho de Carne Opção Vegetariana: PVT Rico Macarrão ao Sugo Sobremesa: Gelatina de Cereja Mamão Minipão Suco
02/05/2016,Almoço,Saladas Diversas Isca de carne acebolada Opção Vegetariana: PVT Caipira Chuchu Refogado Sobremesa: Gelatina de Morango Banana Minipão Suco
02/05/2016,Jantar,Saladas Diversas Filé de Coxa Assado Opção Vegetariana: PVT com Jardineira de legumes Batata Palha Sobremesa: Arroz Doce Laranja Minipão Suco
03/05/2016,Almoço,Saladas Diversas Carne de Panela Opção Vegetariana: PVT ao Vinagrete Farofa Rica Sobremesa: Flan de Baunilha Laranja Minipão Suco
03/05/2016,Jantar,Saladas Diversas Jardineira de carne moída Opção Vegetariana: PVT Alemão Folhas Mistas Refogadas Sobremesa: Doce de Cocada cremosa Caqui Minipão Suco
04/05/2016,Almoço,Frango Xadrez Opção Vegetariana: Xadrez de PVT Repolho Refogado Sobremesa: Pudim de Chocolate mamão Minipão Suco
04/05/2016,Jantar,Carne em cubos Acebolada Opção Vegetariana: PVT Rica Abóbora Refogada Sobremesa: Gelatina de Abacaxi Banana Minipão Suco
05/05/2016,Almoço,Saladas Diversas Strogonoff de Carne Opção Vegetariana: Strogonoff de PVT Batata Palha Sobremesa: Found de Leite Caqui Minipão Suco
05/05/2016,Jantar,Saladas Diversas Filé de Frango à Pizzaiolo Opção Vegetariana: PVT Caipira Creme de milho Sobremesa: Doce de leite com morango Ponkan Minipão Suco
06/05/2016,Almoço,Penil em Cubos Acebolado Opção Vegetariana: PVT com Jardineira de legumes Berinjela Refogada Sobremesa: Flan de papaya Laranja
09/05/2016,Almoço,Saladas Diversas Bisteca Suína Opção Vegetariana: PVT Alemão Abobrinha Picante Sobremesa: Flan de Baunilha Melancia Minipão Suco Arroz Feijão Arroz Integral
09/05/2016,Jantar,Saladas Diversas Bife Grelhado Opção Vegetariana: PVT ao Pizzaiolo Cenoura Sautê Sobremesa: Doce de Leite Banana Minipão Suco Arroz Feijão Arroz Integral
10/05/2016,Almoço,Saladas Diversas Jardineira de Carne Moída Opção Vegetariana: PVT com mandioca Repolho Refogado Sobremesa: Curau Goiaba Minipão Suco
10/05/2016,Jantar,Saladas Diversas Bife à caçarola Opção Vegetariana: Almondega de PVT Macarrão Sobremesa: Pudim de Chocolate Laranja Minipão Suco
11/05/2016,Almoço,Saladas Diversas Salsicha ao molho sugo Opção Vegetariana: PVT Rico Purê de batata Sobremesa: Arroz doce Mamão Minipão Suco
11/05/2016,Jantar,Saladas Diversas Copa-Lombo ao molho de Limão Opção Vegetariana: PVT Gratinado Couve Refogada Sobremesa: Curau Banana Minipão Suco
12/05/2016,Almoço,Strogonoff de Frango Opção Vegetariana: Ovo Cozido Batata Palha Sobremesa: Doce de Goiabada Laranja Minipão Suco
12/05/2016,Jantar,Kibe de Forno Opção Vegetariana: PVT Caipira Repolho refogado Sobremesa: Gelatina de Framboesa Caqui Minipão Suco
13/05/2016,Almoço,Saladas Diversas Escondidinho de Carne moída Opção Vegetariana: PVT com Legumes Virado de Acelga Sobremesa: Gelatina de Abacaxi Caqui Minipão Suco
13/05/2016,Jantar,Saladas Diversas Frango Xadrez Opção Vegetariana: PVT Xadrez Batata Sautê Sobremesa: Flan de Papaya laranja Minipão Suco
16/05/2016,Almoço,Saladas Diversas Fricassê de Frango Opção Vegetariana: PVT a Pizzaiolo Batata Sautê Sobremesa: Pudim de Caramelo Laranja
16/05/2016,Jantar,Saladas Diversas Iscas Grelhadas ao molho Shoyu Opção Vegetariana: PVT Rico Polenta Cremosa Sobremesa: Gelatina Limão banana Minipão Suco Minipão Suco
17/05/2016,Almoço,Saladas Diversas Almondega ao Sugo Opção Vegetariana: PVT Caipira Purê de Batata Sobremesa: Doce de Leite Melancia Minipão Suco
17/05/2016,Jantar,Saladas Diversas Cupim Assado Opção Vegetariana: PVT Alemão Chuchu Refogado Sobremesa: Flan de Baunilha Ponkan Minipão Suco
18/05/2016,Jantar,Copa Lombo ao molho Agridoce Opção Vegetariana: PVT ao Vinagrete Macarrão alho e óleo Sobremesa: Arroz Doce Abacaxi Minipão Suco Minipão Suco
18/05/2016,Almoço,Bife Acebolado Opção Vegetariana: PVT com Mandioca Acelga Refogada Sobremesa: Pudim de Chocolate Banana
19/05/2016,Almoço,Saladas Diversas Jardineira de Carne moída Opção Vegetariana: PVT com jardineira de legumes Polenta Cremosa Sobremesa: Flan de Papaya Goiaba
19/05/2016,Jantar,Saladas Diversas Strogonoff de Carne Opção Vegetariana: Strogonoff de PVT Batata Palha Sobremesa: Gelatina de Morango Caqui Minipão Suco Minipão Suco
20/05/2016,Almoço,Saladas Diversas Lagarto ao Molho Madeira Opção Vegetariana: PVT Alemão Farofa Simples Sobremesa: Gelatina de framboesa Laranja Minipão SucoSábado
23/05/2016,Almoço,Saladas Diversas Bife de Panela Opção Vegetariana: PVT Gratinado Macarrão ao Sugo Sobremesa: Gelatina de Morango Laranja Minipão Suco
23/05/2016,Jantar,Saladas Diversas Filé de Coxa grelhado Opção Vegetariana: PVT com Abobrinha e Batata Batata Sauté Sobremesa: Curau Ponkan Minipão Suco
24/05/2016,Almoço,Saladas Diversas Iscas de Carne Acebolada Opção Vegetariana: PVT Rico Batata Palha Sobremesa: Doce de Leite Maçã Minipão Suco
24/05/2016,Jantar,Saladas Diversas Linguiça Acebolada Opção Vegetariana: PVT Gratinado Polenta Cremosa Sobremesa: Danette Cremoso Melancia Minipão Suco
25/05/2016,Almoço,Saladas Diversas Escondidinho de carne Opção Vegetariana: Ovo Frito Chuchu refogado Sobremesa: Arroz Doce banana Minipão Suco
25/05/2016,Jantar,Saladas Diversas Lagarto Acebolado Opção Vegetariana: PVT com Cenoura Farofa Simples Sobremesa: Gelatina de Cereja Laranja Minipão Suco
30/05/2016,Jantar,Saladas Diversas Carne moída refogada Opção Vegetariana: PVT ao Vinagrete Polenta Cremosa Sobremesa: Gelatina de Cereja Banana Minipão Suco
31/05/2016,Almoço,Saladas Diversas Strogonoff de Carne Opção Vegetariana: PVT Alemão Batata Palha Sobremesa: Pudim de Chocolate Banana Minipão Suco
31/05/2016,Jantar,Saladas Diversas Escondidinho de Carne Opção Vegetariana: Ovo Cozido Acelga Refogada Sobremesa: Doce de Cocada Cremosa Laranja Minipão Suco
01/06/2016,Almoço,Saladas Diversas Carne de Panela com molho vermelho Opção Vegetariana: PVT com Vagem e Batata Polenta Mole Sobremesa: Gelatina de Cereja Maçã Minipão Suco
01/06/2016,Jantar,Saladas Diversas Bife ao molho barbecue Opção Vegetariana: PVT com mandioquinha Legumes Sauté Sobremesa: Paçoca Laranja Minipão Suco
02/06/2016,Almoço,Peixada com leite de coco Opção Vegetariana: PVT com Couve Flor Quiabo Refogado Sobremesa: Doce de Banana Melancia Minipão Suco
02/06/2016,Jantar,Torta Madalena de carne Opção Vegetariana: Torta Madalena de PVT Repolho Refogado Sobremesa: Doce de Leite Caqui Minipão Suco
03/06/2016,Almoço,Saladas Diversas Strogonoff de Frango Opção Vegetariana: Strogonoff de PVT Batata Palha Sobremesa: Flan de Baunilha mamão Minipão Suco
03/06/2016,Jantar,Saladas Diversas Lagarto ao molho madeira Opção Vegetariana: Ovo Cozido Creme de Milho Sobremesa: Gelatina de Morango Banana Minipão Suco
06/06/2016,Almoço,Saladas Diversas Copa-Lombo Acebolado Opção Vegetariana: PVT gratinado Batata doce com cheiro verde Sobremesa: Doce de Prestígio Caqui Minipão Suco
06/06/2016,Jantar,Saladas Diversas Sobrecoxa ao molho de laranja Opção Vegetariana: PVT ao alemão Creme de espinafre Sobremesa: Curau Banana Minipão Suco
07/06/2016,Almoço,Saladas Diversas Linguiça Suína Opção Vegetariana: PVT com mandioca Legumes na manteiga Sobremesa: Arroz Doce Ponkan Minipão Suco
07/06/2016,Jantar,Saladas Diversas Cubos de carne acebolado Opção Vegetariana: Almôndega de PVT Macarrão ao sugo Sobremesa: Pudim de Chocolate Mamão Minipão Suco
08/06/2016,Jantar,Saladas Diversas Bife ao molho especial Opção Vegetariana: PVT com milho Acelga Refogada Sobremesa: Curau Maçã Minipão Suco
09/06/2016,Almoço,Bife à caçarole Opção Vegetariana: Ovo Frito Farofa Simples Sobremesa: Gelatina de Framboesa Melão
09/06/2016,Jantar,Frango na mostarda Opção Vegetariana: PVT com escarola Sopa de Legumes Sobremesa: Pudim de Baunilha Mamão Minipão Suco Minipão Suco
10/06/2016,Almoço,Saladas Diversas Jardineira de Carne Moída Opção Vegetariana: PVT com jardineira Acelga ao shoyu Sobremesa: Doce cocada cremosa Melancia Minipão Suco
10/06/2016,Jantar,Saladas Diversas Cupim ao molho shoyu Opção Vegetariana: PVT ao molho de vinagrete Polenta Cremosa Sobremesa: Flan de Papaya ponkan Minipão Suco Arroz Feijão Arroz Integral
13/06/2016,Almoço,Saladas Diversas Almondega ao sugo Opção Vegetariana: PVT com cenoura Macarrão alho e óleo Sobremesa: Doce de Prestígio maçã Minipão Suco
13/06/2016,Jantar,Saladas Diversas Lagarto Acebolado Opção Vegetariana: PVT rico Farofa Rica Sobremesa: Gelatina de limão banana Minipão Suco
14/06/2016,Almoço,Saladas Diversas Fricassé de Frango Opção Vegetariana: PVT com azeitonas Batata palha Sobremesa: Flan de Baunilha Laranja Minipão Suco
14/06/2016,Jantar,Saladas Diversas Carne de Panela Opção Vegetariana: Ovo cozido Creme de milho Sobremesa: Doce de leite Caqui Minipão Suco
15/06/2016,Jantar,Saladas Diversas Peixada com molho vermelho Opção Vegetariana: PVT caipira Cenoura Sautê Sobremesa: Gelatina de laranja Melancia Minipão Suco
15/06/2016,Almoço,Saladas Diversas Carne moída ao molho vermelho Opção Vegetariana: PVT com Vagem Escarola refogada Sobremesa: Paçoca Mamão Minipão Suco
16/06/2016,Almoço,Saladas Diversas Cubos Acebolado Opção Vegetariana: PVT gratinado Polenta mole Sobremesa: Pudim de Chocolate Caqui Minipão Suco
16/06/2016,Jantar,Saladas Diversas Sobrecoxa assada Opção Vegetariana: Almondega de PVT Caldo de ervilha Sobremesa: Flan de Baunilha Laranja Minipão Suco
17/06/2016,Almoço,Saladas Diversas Bife Acebolado Opção Vegetariana: PVT com brócolis Repolho refogado ao molho de mostarda Sobremesa: Doce de leite c amendoim Ponkan
20/06/2016,Almoço,Saladas Diversas Strogonoff de Frango Opção Vegetariana: Strogonoff de PVT Batata Palha Sobremesa: Doce de Abóbora Maçã Minipão Suco
20/06/2016,Jantar,Saladas Diversas Jardineira de carne moída Opção Vegetariana: Jardineira de PVT Polenta mole Sobremesa: Gelatina de Framboesa Banana Minipão Suco
21/06/2016,Almoço,Saladas Diversas Lagarto ao molho madeira Opção Vegetariana: PVT Rico Farofa de ovos com cenoura Sobremesa: Pudim de Caramelo Ponkan
21/06/2016,Jantar,Saladas Diversas Carne de Panela Opção Vegetariana: PVT caipira Acelga Refogada Sobremesa: Gelatina de limão Caqui Minipão Suco Minipão Suco
22/06/2016,Almoço,Bife à Caçarole Opção Vegetariana: PVT com azeitona Abobrinha picante Sobremesa: Prestígio cremoso Banana Minipão Suco
22/06/2016,Jantar,Sobrecoxa assada Opção Vegetariana: PVT com cenoura Couve Refogada Sobremesa: Curau Laranja Minipão Suco
23/06/2016,Almoço,Saladas Diversas Iscas de carne ao molho agridoce Opção Vegetariana: Ovo cozido Cenoura Sauté Sobremesa: Gelatina de Morango Melão Minipão Suco
23/06/2016,Jantar,Saladas Diversas Copo Lombo acebolado Opção Vegetariana: PVT com couve flor Chuchu refogada com mostarda Sobremesa: Doce de leite Mamão Minipão Suco
24/06/2016,Almoço,Saladas Diversas Frango caipira Opção Vegetariana: PVT ao vinagrete Milho Cozido Sobremesa: Paçoca Ponkan Minipão Suco
24/06/2016,Jantar,Saladas Diversas Goulash de Carne Opção Vegetariana: Goulash de PVT Batata Sauté Sobremesa: Goiabada Laranja Minipão Suco
25/06/2016,Jantar,Saladas Diversas Bife Acebolado Opção Vegetariana: PVT Rico Acelga na mostarda Sobremesa: Doce de Abóbora caseiro Melancia Minipão Suco
27/06/2016,Almoço,Saladas Diversas Cubos de frango acebolado Opção Vegetariana: PVT com Mandioquinha Polenta Cremosa Sobremesa: Pé de moleque Ponkan
27/06/2016,Jantar,Saladas Diversas Jardineira de carne moída Opção Vegetariana: PVT Alemão Chuchu Refogado Sobremesa: Gelatina de Morango Caqui Minipão Suco Minipão Suco
28/06/2016,Almoço,Saladas Diversas Strogonoff de Carne Opção Vegetariana: Strogonoff de PVT Batata palha Sobremesa: Pudim de chocolate laranja Minipão Suco
28/06/2016,Jantar,Saladas Diversas Carne de Panela Opção Vegetariana: Torta Madalena de PVT Folhas mistas refogada Sobremesa: Flan de Baunilha Melancia Minipão Suco
29/06/2016,Almoço,Saladas Diversas Carne de Panela Opção Vegetariana: PVT Caipira Farofa Rica Sobremesa: Gelatina de Framboesa Banana
29/06/2016,Jantar,Saladas Diversas Sobrecoxa assada Opção Vegetariana: PVT ao vinagrete Pirão Sobremesa: Doce de Leite Melão Minipão Suco Minipão Suco
30/06/2016,Almoço,Saladas Diversas Lagarto Assado Opção Vegetariana: Ovo cozido Abobrinha Picante Sobremesa: Doce de abobora Melão Minipão Suco
30/06/2016,Jantar,Saladas Diversas Bife acebolado ao molho especial Opção Vegetariana: PVT com brócolis Batata doce com cheiro verde Sobremesa: Bananada caqui Minipão Suco
01/07/2016,Almoço,Saladas Diversas Iscas de carne ao molho shoyu Opção Vegetariana: PVT com shoyu Abobrinha picante Gelatina de Limão Melão Minipão Suco
05/07/2016,Almoço,Saladas Diversas Lagarto ao molho madeira Opção Vegetariana: PTV com cogumelo Polenta mole Sobremesa: Gelatina de morango banana Minipão Suco
07/07/2016,Jantar,Saladas Diversas Cupim ao molho escuro Escarola Refogada Sobremesa: Canjica Banana Minipão Suco Minipão Suco
25/07/2016,Almoço,Saladas Diversas Iscas de Frango ao molho caipira Opção Vegetariana: PVT Folhas mista refogada Sobremesa: Doce de Prestígio Cremoso Mexerica
25/07/2016,Jantar,Saladas Diversas Carne de panela Opção Vegetariana: PVT ao vinagrete Chuchu refogado Sobremesa: Pudim de chocolate Maçã Minipão Suco Minipão Suco
27/07/2016,Almoço,Saladas Diversas Filé de frango Grelhado com molho de mostarda Opção Vegetariana: PVT com mandioca Abobrinha refogada Sobremesa: Pudim de Caramelo Maçã
29/07/2016,Almoço,Saladas Diversas Pernil acebolado Opção Vegetariana: PVT com espinafre Macarrão ao alho e óleo Sobremesa: Torrone Laranja Minipão Suco
29/07/2016,Jantar,Saladas Diversas Frango assado Opção Vegetariana: Ovo Frito Cenoura Refogada Sobremesa: Gelatina de Uva Mamão Minipão Suco
01/08/2016,Almoço,Saladas Diversas Carne Moída à primavera Opção Vegetariana: PVT Gratinado Acelga Refogada Sobremesa: Pudim de Caramelo Banana
01/08/2016,Jantar,Saladas Diversas Frango Acebolado Opção Vegetariana: PVT com Mandioca Legumes Sauté Sobremesa: Pudim de Morango Laranja Minipão Suco Minipão Suco
02/08/2016,Almoço,Bife Acebolado Opção Vegetariana: PVT com Tomate Chuchu refogado Sobremesa: Gelatina de Cereja Maça Minipão Suco
02/08/2016,Jantar,Copa-Lombo Opção Vegetariana: PVT Alemão Abobrinha Refogada Sobremesa: Gelatina de Framboesa Mexirica Minipão Suco
03/08/2016,Almoço,Strogonoff de Frango Opção Vegetariana: Strogonoff de PVT Batata Palha Sobremesa: Pudim de Chocolate Laranja
03/08/2016,Jantar,Peixada com Legumes Opção Vegetariana: PVT ao vinagrete Chicória Refogada Sobremesa: Arroz Doce Banana Minipão Suco Minipão Suco
04/08/2016,Almoço,Saladas Diversas Saladas Diversas Linguiça Acebolada Opção Vegetariana: Ovo Frito Farofa Rica Sobremesa: Torrone Melancia Minipão Suco
04/08/2016,Jantar,Iscas de Carne ao Molho Barbecue Opção Vegetariana: PVT com Brócolis Repolho Refogado Sobremesa: Pudim de Baunilha Mamão Minipão Suco
05/08/2016,Almoço,Saladas Diversas Carne de Panela Opção Vegetariana: PVT com cenoura Macarrão ao alho e óleo Sobremesa: Pudim de Morango Mamão Minipão Suco
05/08/2016,Jantar,Saladas Diversas Sobrecoxa Assada Opção Vegetariana: PVT com Azeitona Farofa de Banana Sobremesa: Torrone Melancia Minipão Suco
08/08/2016,Almoço,Saladas Diversas Bife à Caçarola Opção Vegetariana: PVT com Mandioca Polenta Sobremesa: Pé de Moleque Melão Minipão Suco
08/08/2016,Jantar,Saladas Diversas Escondidinho de Carne Opção Vegetariana: PVT Caipira Cenoura Refogada Sobremesa: Goiabada Banana Minipão Suco
09/08/2016,Almoço,Saladas Diversas Iscas de Frango Grelhado Opção Vegetariana: PVT ao Vinagrete Creme de Milho Sobremesa: Flan de Baunilha Laranja Minipão Suco
09/08/2016,Jantar,Saladas Diversas Strogonoff de Carne Opção Vegetariana: Strogonoff de PVT Batata Palha Sobremesa: Delicaxi Mamão Minipão Suco
10/08/2016,Almoço,Saladas Diversas Carne de Panela Opção Vegetariana: Ovo Cozido Abobrinha Refogada Sobremesa: Gelatina de Framboesa Banana
10/08/2016,Jantar,Saladas Diversas Fricassê de Frango Opção Vegetariana: Fricassê de PVT Acelga Refogada Sobremesa: Pudim de Chocolate Laranja Minipão Suco Minipão Suco
11/08/2016,Almoço,Saladas Diversas Almôndega ao Sugo Opção Vegetariana: Almôndega de PVT Opção Vegetariana: PVT Com Abobrinha Macarrão alho e óleo Sobremesa: Pudim de Caramelo Maça Minipão Suco
11/08/2016,Jantar,Saladas Diversas Carne em Cubos e Batata Chuchu Refogado Sobremesa: Pudim de Baunilha Melancia Minipão Suco
12/08/2016,Almoço,Saladas Diversas Pernil Acebolado Opção Vegetariana: PVT com Milho e Ervilha Farofa Rica Sobremesa: Flan de Papaya Melancia
12/08/2016,Jantar,Saladas Diversas Iscas de Carne ao Molho Madeira Opção Vegetariana: PVT com Escarola Purê de Batata Sobremesa: Gelatina de Cereja Mamão Minipão Suco Minipão Suco
16/08/2016,Almoço,Saladas Diversas Strogonoff de Frango Opção Vegetariana: Strogonoff de PVT Batata Palha Sobremesa: Flan de Chocolate Mamão Minipão Suco
16/08/2016,Jantar,Saladas Diversas Iscas de Carne ao Molho Argentino Opção Vegetariana: PVT com Pimentão Mandioca Sauté Sobremesa: Arroz doce Melão Minipão Suco
17/08/2016,Almoço,Copa-Lombo Acebolado Opção Vegetariana: PVT Com Brócolis Cenoura Refogada Sobremesa: Paçoca Melancia Minipão Suco
17/08/2016,Jantar,Sobrecoxa Assada Opção Vegetariana: Jardineira de PVT Creme de Espinafre Sobremesa: Doce de Leite Cremoso Banana Minipão Suco
18/08/2016,Almoço,Saladas Diversas Bife ao Molho Barbecue Opção Vegetariana: PVT com Repolho Creme de Ervilha Sobremesa: Doce de Banana Maça Minipão Suco
18/08/2016,Jantar,Saladas Diversas Carne de Panela Opção Vegetariana: PVT Rico Farofa Rica Sobremesa: Gelatina de Limão Mexirica Minipão Suco
19/08/2016,Almoço,Carne Moída ao Molho Cubos de Frango Acebolado Opção Vegetariana: PVT com Cogumelo Polenta Mole Sobremesa: Doce de Leite Cremoso Laranja
19/08/2016,Jantar,Opção Vegetariana: PVT com Azeitona Repolho Refogado Sobremesa: Pudim de Coco Mamão Minipão Suco Minipão Suco
20/08/2016,Almoço,Saladas Diversas Bife Grelhado Opção Vegetariana: PVT Alemão Berinjela Refogada Sobremesa: Arroz Doce Banana Minipão Suco
22/08/2016,Jantar,Saladas Diversas Bife ao Molho Especial Opção Vegetariana: PVT com Azeitona Repolho Bicolor Refogado Sobremesa: Canjica Laranja Minipão Suco
23/08/2016,Almoço,Bisteca Acebolada Opção Vegetariana: PVT Rico Farofa de Cenoura Sobremesa: Torrone Mamão Minipão Suco
23/08/2016,Jantar,Cubos de Carne com tomate Opção Vegetariana: PVT com Tomate Chuchu Sauté Sobremesa: Flan de Chocolate Melancia Minipão Suco
24/08/2016,Almoço,Saladas Diversas Strogonoff de Carne Opção Vegetariana: Strogonoff de PVT Batata Palha Sobremesa: Flan de Papaya Maça Minipão Suco
24/08/2016,Jantar,Saladas Diversas Iscas de Frango com Mostarda Opção Vegetariana: PVT Alemão Berinjela Refogada Sobremesa: Doce de Prestigio Banana Minipão Suco
25/08/2016,Almoço,Saladas Diversas Jardineira de Carne Moída Opção Vegetariana: PVT com Couve Opção Vegetariana: PVT com Brócolis Flor Polenta Sobremesa: Gelatina de Cereja Mexirica
25/08/2016,Jantar,Saladas Diversas Iscas de Carne Acebolada Abóbora refogada Sobremesa: Pudim de Morango Mamão Minipão Suco Minipão Suco
26/08/2016,Almoço,Saladas Diversas Peixe com leite de coco Opção Vegetariana: PVT Rico Acelga Refogada Sobremesa: Pudim de Coco Banana Minipão Suco
26/08/2016,Jantar,Saladas Diversas Kibe de Forno Opção Vegetariana: PVT com Abobrinha e Batata Creme de Milho Sobremesa: Gelatina de Morango Mexirica Minipão Suco
29/08/2016,Almoço,Saladas Diversas Hambúrguer ao Molho Barbecue Macarrão Alho e óleo Sobremesa: Bananada Ponkan Minipão Suco
